{
  "instruction_id": "none",
  "prompt_path": "build-control/prompts/RUNNER_SELF_TEST.md",
  "prompt_sha256": "0000000000000000000000000000000000000000000000000000000000000000",
  "expected_base_commit": "0000000000000000000000000000000000000000",
  "milestone": "NONE",
  "scope": "No pending instruction.",
  "allow_unattended": false,
  "notes": "Inactive. The runner treats allow_unattended=false as 'nothing is authorised' and does not launch Claude. To activate work, Build Control commits the prompt (commit A), then commits this file (commit B) with allow_unattended=true, expected_base_commit set to A, and prompt_sha256 set to the SHA-256 of `git cat-file blob A:<prompt_path>`. See build-control/runner/README.md."
}
